{
  "schemaVersion": 1,
  "rule": "SR-RVD-032",
  "session": "design-review",
  "assertions": [
    {
      "kind": "rubric",
      "rubric": "Does the checklist item data model and lifecycle (the new tables, the by-hand column, retention) get a verdict with cited reasoning, and does a failing verdict become a finding?"
    }
  ]
}
