{
  "schemaVersion": 1,
  "rule": "SR-RVD-091",
  "session": "design-review",
  "assertions": [
    {
      "kind": "rubric",
      "rubric": "Does the agent apply the question whether the problem itself is wrong, routed back to the requirements when it is, and cite the design where it yields a finding?"
    }
  ]
}
