{
  "schemaVersion": 1,
  "rule": "SR-RVD-012",
  "session": "design-review",
  "assertions": [
    {
      "kind": "message_matches",
      "pattern": "(?i)blocker|cardinal sin",
      "turn": 5
    },
    {
      "kind": "rubric",
      "rubric": "When the developer stops, does the recap name the cardinal sins and blockers still open as blocking the design approval, and does every finding left without a decision, a cardinal sin or blocker shown but not answered included, get its own minutes line (severity, title, not walked, open)?"
    }
  ]
}
