{
  "schemaVersion": 1,
  "rule": "SR-RVD-055",
  "session": "design-review",
  "assertions": [
    {
      "kind": "message_matches",
      "pattern": "(?i)single worker|worker thread|single point"
    },
    {
      "kind": "rubric",
      "rubric": "Is cardinal sin 3 of the design (the single worker thread on the write path with no acceptance) raised as a blocker, before any other severity, whatever the design's justification?"
    }
  ]
}
